OFFER,RETAILER,BRAND,BRAND_BELONGS_TO_CATEGORY,IS_CHILD_CATEGORY_TO
"Spend $50 on a Full-Priced new Club Membership","SAMS CLUB","SAMS CLUB",NULL,NULL
"Beyond Meat Plant-Based products, spend $25",,"BEYOND MEAT",NULL,NULL
"Good Humor Viennetta Frozen Vanilla Cake",,"GOOD HUMOR",NULL,NULL
"Butterball, select varieties, spend $10 at Dillons Food Store","DILLONS FOOD STORE",BUTTERBALL,NULL,NULL
"GATORADE Fast Twitch, 12-ounce 12 pack, at Amazon Storefront*",AMAZON,GATORADE,"Medicines & Treatments","Health & Wellness"
"GATORADE Fast Twitch, 12-ounce 12 pack, at Amazon Storefront*",AMAZON,GATORADE,"Sports Drinks","Sports Drinks & Enhanced Waters"
"Emmy's Organics Cookies OR Brownie Snaps",,"EMMYS POP UP",NULL,NULL
"Dr Pepper, Regular OR Zero Sugar Strawberries and Cream 12 pack, at select retailers","UNITED SUPERMARKETS","DR PEPPER","Cooking & Baking",Pantry
"Dr Pepper, Regular OR Zero Sugar Strawberries and Cream 12 pack, at select retailers","UNITED SUPERMARKETS","DR PEPPER","Carbonated Soft Drinks",Beverages
"Arnold, Brownberry, Oroweat Small Slice bread, at Walmart",WALMART,"ARNOLD BROWNBERRY OROWEAT",Bread,Pantry
"Barilla Pesto Sauce",,BARILLA,Chips,Snacks
"Barilla Pesto Sauce",,BARILLA,"Dry Pasta","Pasta & Noodles"
"Any General Mills products, buy 2
Good Rewards Members Only",,"ANNIES HOMEGROWN GROCERY",NULL,NULL
"Egglife Egg White Wraps at Aldi",ALDI,EGGLIFE,NULL,NULL
"Spend $20 at Zaxby's",ZAXBYS,ZAXBYS,NULL,NULL
"Spend $10 at Subway",SUBWAY,SUBWAY,NULL,NULL
"DOVE Chocolate, select sizes, buy 1",,"DOVE CHOCOLATE",NULL,NULL
"Hellmann's OR Best Foods Garlic Aioli OR Spicy Mayonnaise",,"HELLMANNS BEST FOODS",Condiments,Pantry
"M&M'S, select sizes, buy 1",,M&MS,Candy,Snacks
"GATORLYTE OR GATORADE Fit Single Serve Bottle, select varieties, buy 2",,GATORADE,"Medicines & Treatments","Health & Wellness"
"GATORLYTE OR GATORADE Fit Single Serve Bottle, select varieties, buy 2",,GATORADE,"Sports Drinks","Sports Drinks & Enhanced Waters"
"Beyond Steak Plant-Based seared tips, 10 ounce at Target",TARGET,"BEYOND MEAT",NULL,NULL
"Red Gold Tomato Ketchup",,"RED GOLD",NULL,NULL
"Gillette Venus  for Pubic Hair & Skin spend $20",,"GILLETTE VENUS","Hair Removal","Health & Wellness"
"Spend $140 at Shaws",SHAWS,SHAWS,NULL,NULL
"L'Oral Paris Hair color, select varieties, spend $19 at Target",TARGET,"LOREAL PARIS HAIR COLOR",NULL,NULL
"Simply Spiked Lemonade 12 pack+",,"SIMPLY SPIKED",NULL,NULL
"Gorton's, at select retailers","SHOP RITE",GORTONS,NULL,NULL
"Shop 2 times at ACME",ACME,ACME,NULL,NULL
"Butterball, select varieties, spend $10 at Ralphs",RALPHS,BUTTERBALL,NULL,NULL
"Beyond Steak Plant-Based seared tips, 10 ounce, buy 2 at H-E-B",H-E-B,"BEYOND MEAT",NULL,NULL
"Butterball, select varieties, Spend $10 at Ruler Foods","RULER FOODS",BUTTERBALL,NULL,NULL
"Spend $20 at KFC",KFC,KFC,NULL,NULL
"Spend $15 at Nekter","NEKTER JUICE BAR",NEKTER,NULL,NULL
"Order online at Zaxbys.com",ZAXBYS,ZAXBYS,NULL,NULL
"Butterball, select varieties, spend $10 at King Soopers","KING SOOPERS",BUTTERBALL,NULL,NULL
"Order from Casey's app or Caseys.com","CASEYS GENERAL STORE","CASEYS GENERAL STORE",NULL,NULL
"Tru-Ray Premium Construction Paper, spend $10",,TRURAY,NULL,NULL
"Flonase Allergy Relief, at Walmart",WALMART,FLONASE,NULL,NULL
"Spend $25 at KFC",KFC,KFC,NULL,NULL
"Gorton's Air Fried Butterfly Shrimp, at Walmart",WALMART,GORTONS,NULL,NULL
"CESAR Wet Dog Food, spend $20",,CESAR,NULL,NULL
"TWIX, select sizes",,TWIX,Candy,Snacks
"M&M'S chocolate candies, select varieties",,M&MS,Candy,Snacks
"Hidden Valley Ranch Salad Dressing OR Secret Sauce, select varieties",,"HIDDEN VALLEY RANCH","Dips & Salsa",Snacks
"Spend $210 at Randalls",RANDALLS,RANDALLS,NULL,NULL
"Cooked Perfect Meatballs, at Walmart",WALMART,"COOKED PERFECT",NULL,NULL
"Spend $25 at Casey's","CASEYS GENERAL STORE","CASEYS GENERAL STORE",NULL,NULL
"Perfect Keto Barista Blend Collagen & MCTs, online at Amazon",AMAZON,"PERFECT KETO",NULL,NULL
"Creativity Street, spend $10",,"CREATIVITY STREET",NULL,NULL
"Crunchmaster Crackers, spend $4",,CRUNCHMASTER,NULL,NULL
"Tyson Products, select varieties, spend $20 at Sam's Club","SAMS CLUB","BALL PARK FRANK",NULL,NULL
"L'Oral Paris Makeup, spend $35 at Target",TARGET,"LOREAL PARIS COSMETICS",NULL,NULL
"Spend $25 at Subway",SUBWAY,SUBWAY,NULL,NULL
"Any Vons receipt",VONS,VONS,NULL,NULL
"Chosen Foods Mayo, select varieties",,"CHOSEN FOODS",NULL,NULL
"L'Oral Paris Men Expert hair color, spend $19 at Walmart",WALMART,"LOREAL PARIS HAIR COLOR",NULL,NULL
"Spend $185 at Shaws",SHAWS,SHAWS,NULL,NULL
"Spend $150 at Vons",VONS,VONS,NULL,NULL
"Wine from TheBarrelRoom.com, spend $30",GALLO.COM,ALAMOS,NULL,NULL
"General Mills products, select brands, spend $35",,"ANNIES HOMEGROWN GROCERY",NULL,NULL
"PepsiCo Beverage, 7.5-ounce 10 pack, select varieties, at Amazon Storefront*",AMAZON,PEPSI,"Carbonated Soft Drinks",Beverages
"Sara Lee bread, select varieties, buy 2 at Walmart",WALMART,"SARA LEE",Bread,Pantry
"Sara Lee or Alfaros Artesano bread, buy 5",,ALFAROS,NULL,NULL
"Bai Antioxidant, 6 pack, buy 2 at Walmart",WALMART,BAI,"Fruit Juices",Beverages
"Spend $5 in-store at Casey's","CASEYS GENERAL STORE","CASEYS GENERAL STORE",NULL,NULL
"Reese's Chocolate Cones, 8 count at GIANT OR MARTINS","MARTINS FOODS",KLONDIKE,"Frozen Desserts",Frozen
"Spend $25 at Fresh Thyme Market","FRESH THYME MARKET","FRESH THYME MARKET",NULL,NULL
"Any Albertsons receipt",ALBERTSONS,ALBERTSONS,NULL,NULL
"Shop 2 times at Albertsons",ALBERTSONS,ALBERTSONS,NULL,NULL
"Select beverages AND prepared food items at Casey's","CASEYS GENERAL STORE","CASEYS GENERAL STORE",NULL,NULL
"QUEEN V The VIP & The Wingwoman Soft Touch Silicone Vibrator at Walmart",WALMART,"QUEEN V",NULL,NULL
"Back to the Roots Grow Seed Starting Pots OR Germination Trays, at Walmart or Target",TARGET,"BACK TO THE ROOTS",NULL,NULL
"Dove Hand Wash, select varieties, buy 2 at Target",TARGET,DOVE,"Deodorant & Antiperspirant","Health & Wellness"
"Dove Hand Wash, select varieties, buy 2 at Target",TARGET,DOVE,"Bath & Body","Health & Wellness"
"Frutero Ice Cream, 1 pint",,FRUTERO,NULL,NULL
"Red Gold Tomato Juice",,"RED GOLD",NULL,NULL
"Bio-Oil Skincare Oil OR Gel, select varieties",,"BIO OIL",NULL,NULL
"Spend $65 at Albertsons",ALBERTSONS,ALBERTSONS,NULL,NULL
"Welch'sFruit Snacks, select varieties, buy 2",,"WELCHS FRUIT SNACKS","Fruit & Vegetable Snacks",Snacks
"Talenti Mini Bars",,TALENTI,"Frozen Desserts",Frozen
"Visit OR order online from Casey's 7 times","CASEYS GENERAL STORE","CASEYS GENERAL STORE",NULL,NULL
"Simply Spiked Signature Peach 12-pack or larger, buy 2",,"SIMPLY SPIKED",NULL,NULL
"Molson Coors, select varieties, 12 pack+",,"COORS LIGHT",Makeup,Beauty
"Molson Coors, select varieties, 12 pack+",,"COORS LIGHT",Beer,Alcohol
"Welch's Zero Sugar Fruity Bites, 6 pack+, online at Amazon",AMAZON,"WELCHS FRUIT SNACKS","Fruit & Vegetable Snacks",Snacks
"PepsiCo Variety Pack, select varieties, at Amazon Storefront*",AMAZON,PEPSI,"Carbonated Soft Drinks",Beverages
"Spend $100 at Vons",VONS,VONS,NULL,NULL
"Spend $15 at Subway",SUBWAY,SUBWAY,NULL,NULL
"Spend $35 at Fresh Thyme Market","FRESH THYME","FRESH THYME MARKET",NULL,NULL
"Sign up for The Club Card or The Club+ Card full-priced membership* (New Members Only)","BJS WHOLESALE","BJS WHOLESALE",NULL,NULL
"Marinela sweet baked goods, buy 2",,MARINELA,NULL,NULL
"Back to the Roots Soils, select varieties and sizes, at Walmart",WALMART,"BACK TO THE ROOTS",NULL,NULL
"Any General Mills products, spend $60",,"ANNIES HOMEGROWN",NULL,NULL
"Welch's Fruit Snacks, select varieties, 6 count+, buy 3",,"WELCHS FRUIT SNACKS","Fruit & Vegetable Snacks",Snacks
"Spend $90 at Tom Thumb","TOM THUMB","TOM THUMB",NULL,NULL
"Spend $5 on single-serve prepared food items at Casey's","CASEYS GENERAL STORE","CASEYS GENERAL STORE",NULL,NULL
"Coors Light, Miller Lite OR VIZZY 12 pack+",,VIZZY,NULL,NULL
"Cooked Perfect Meatballs, Homestyle OR Turkey, at Walmart",WALMART,"COOKED PERFECT",NULL,NULL
"12 Pack OR 2 Liter AND Whole Pizza Pie at Casey's","CASEYS GENERAL STORE","CASEYS GENERAL STORE",NULL,NULL
"General Mills products, select brands, spend $7 at Convenience Stores",,"ANNIES HOMEGROWN GROCERY",NULL,NULL
"Gillette Venus  for Pubic Hair & Skin",,"GILLETTE VENUS","Hair Removal","Health & Wellness"
"Barilla Pasta, select varieties, buy 2",,BARILLA,Chips,Snacks
"Barilla Pasta, select varieties, buy 2",,BARILLA,"Dry Pasta","Pasta & Noodles"
"Little Bites Spend $10 at Walmart",WALMART,ENTENMANNS,"Snack Cakes",Snacks
"Envy Apples pre-packed bags",,ENVY,NULL,NULL
"Shop 2 times at Tom Thumb","TOM THUMB","TOM THUMB",NULL,NULL
"Ben & Jerry's Frozen Creme Brulee Non Dairy Dessert, 16 ounce",,"BEN AND JERRYS","Frozen Desserts",Frozen
"Purex laundry detergent, select varieties, at Walmart",WALMART,PUREX,NULL,NULL
"Whole Pizza at Casey's","CASEYS GENERAL STORE","CASEYS GENERAL STORE",NULL,NULL
"Shop 2 times at Safeway",SAFEWAY,SAFEWAY,NULL,NULL
"Any General Mills products, spend $30",,"ANNIES HOMEGROWN",NULL,NULL
"Ben & Jerry's Doggie Desserts, 4 count",,"BEN AND JERRYS","Frozen Desserts",Frozen
"Sol 6 pack+",,"SOL CERVEZA",NULL,NULL
"George's Farmers Market Chicken Wings, at Sam's Club","SAMS CLUB","GEORGES FARMERS MARKET",NULL,NULL
"Michael Angelo's OR Rao's Frozen Entrees, spend $10",,RAO'S,NULL,NULL
"Sargento Sliced Cheese, spend $25",,SARGENTO,Cheese,Dairy
"Sargento Sliced Cheese, spend $12",,SARGENTO,Cheese,Dairy
"Country Crock Plant Based Butter at Walmart",WALMART,"COUNTRY CROCK PLANT BUTTER",NULL,NULL
"Perfect Keto Beauty + Sleep Collagen, online at Amazon",AMAZON,"PERFECT KETO",NULL,NULL
"DOVE chocolate, select varieties",,"DOVE CHOCOLATE",NULL,NULL
"Simply Spiked 12 pack+",,"SIMPLY SPIKED",NULL,NULL
"Perfect Keto Bars, online at Amazon",AMAZON,"PERFECT KETO",NULL,NULL
"Gillette Venus  for Pubic Hair & Skin, spend $20",,"GILLETTE VENUS","Hair Removal","Health & Wellness"
"AleveX at Walmart",WALMART,ALEVE,NULL,NULL
"Envy Apples, pre-packed bags",,ENVY,NULL,NULL
"Ben & Jerry's Frozen Sugar Cookie Dough Chunks, 8 ounce",,"BEN AND JERRYS","Frozen Desserts",Frozen
"LOral Paris Men Expert hair color, spend $9 at Walmart",WALMART,"LOREAL PARIS HAIR COLOR",NULL,NULL
"Reese's Peanut Butter Bar, 6 count, at GIANT OR MARTINS","THE GIANT CO","GOOD HUMOR",NULL,NULL
"Magnum Non-Dairy Hazelnut Crunch Ice Cream Bars, 3 count",,"MAGNUM ICE CREAM",NULL,NULL
"Butterball, select varieties, spend $10 at Fred Meyer","FRED MEYER",BUTTERBALL,NULL,NULL
"Thomas' Bagel Thins, buy 2",,THOMAS,Bread,Pantry
"Spend $60 at TGI Friday's","TGI FRIDAYS","TGI FRIDAYS",NULL,NULL
"Artesano buns, buy 2 at Walmart",WALMART,"SARA LEE ARTESANO",Bakery,"Deli & Bakery"
"STARBURST, select sizes, buy 1",,STARBURST,Candy,Snacks
"Fresh Step Outstretch Cat Litter",,"FRESH STEP",NULL,NULL
"Sara Lee or Alfaros Artesano bread, spend $8",,ALFAROS,NULL,NULL
"Back to the Roots Dry Plant Food, 5 pounds, at The Home Depot","THE HOME DEPOT","BACK TO THE ROOTS",NULL,NULL
"Burt's Bees Sensitive Lotions and Creams, select varieties, at Walmart",WALMART,"BURTS BEES",NULL,NULL
"Durex Massage & Play 2 in 1 Pleasure Gel, select varieties, at Walmart or Target",TARGET,DUREX,NULL,NULL
"Coors Light, Miller Lite OR VIZZY 12 packs+, buy 4",,VIZZY,NULL,NULL
"LIFE SAVERS",,LIFESAVERS,Candy,Snacks
"Butterball, select varieties, spend $10 at Kroger",KROGER,BUTTERBALL,NULL,NULL
"RESPAWN by 5 GUM, at Walmart",WALMART,"5 GUM",Gum,Candy
"Back to the Roots Garden Soil, 1 cubic foot, at Lowe's Home Improvement","LOWES HOME IMPROVEMENT","BACK TO THE ROOTS",NULL,NULL
"SiO Beauty Patches, online at Siobeauty.com",SIOBEAUTY.COM,"SIO BEAUTY",NULL,NULL
"Wesson Oil Products",,WESSON,NULL,NULL
"Bubbies Pickles, Sauerkraut, and Condiments at Whole Foods or Sprouts","SPROUTS FARMERS MARKET",BUBBIES,NULL,NULL
"Michael Angelo's Sauce at Walmart",WALMART,"MICHAEL ANGELO'S",NULL,NULL
"Spend $155 at Pavilions",PAVILIONS,PAVILIONS,NULL,NULL
"CESAR Wet Dog Food Singles",,CESAR,NULL,NULL
"Spend $90 at ACME",ACME,ACME,NULL,NULL
"Hidden Valley Ranch Seasoning Mix Packet, 1 count",,"HIDDEN VALLEY RANCH","Dips & Salsa",Snacks
"Sargento products, select varieties",,SARGENTO,Cheese,Dairy
"Welch's Fruit Snacks, 250 count, online at Amazon",AMAZON,"WELCHS FRUIT SNACKS","Fruit & Vegetable Snacks",Snacks
"Ben & Jerry's, select varieties",,"BEN AND JERRYS","Frozen Desserts",Frozen
"Simply Spiked Signature Peach 12 pack+",,"SIMPLY SPIKED",NULL,NULL
"Beech-Nut snacks, select varieties",,BEECHNUT,NULL,NULL
"Sargento products, select varieties, buy 3",,SARGENTO,Cheese,Dairy
"Spend $250 at ACME",ACME,ACME,NULL,NULL
"Wings OR Cheesy Breadsticks at Casey's","CASEYS GENERAL STORE","CASEYS GENERAL STORE",NULL,NULL
"Butterball, select varieties, spend $10 at Smith's",SMITHS,BUTTERBALL,NULL,NULL
"Perfect Keto Collagen Peptides, online at Amazon",AMAZON,"PERFECT KETO",NULL,NULL
"Perfect Keto MCT Oil Powder, online at Amazon",AMAZON,"PERFECT KETO",NULL,NULL
"Hellmann's OR Best Foods AND Sargento Cheese Slices",,"HELLMANNS BEST FOODS",Condiments,Pantry
"Brita Pitcher AND Filter",,BRITA,NULL,NULL
"Spend $90 at Star Market","STAR MARKET","STAR MARKET",NULL,NULL
"SNICKERS, select sizes, buy 1",,SNICKERS,Candy,Snacks
"Kodiak products, select varieties, spend $10",,"KODIAK CAKES FLAPJACK & WAFFLE MIX",NULL,NULL
"Bays English Muffins",,BAYS,NULL,NULL
"Super Coffee, 12 ounce single serve, buy 3",,"SUPER COFFEE",NULL,NULL
"Sara Lee bread select varieties, buy 2",WALMART,"SARA LEE",Bread,Pantry
"GOYA Coconut Water",,GOYA,"Packaged Vegetables",Pantry
"GOYA Coconut Water",,GOYA,"Cooking & Baking",Pantry
"Spend $35 at TGI Friday's","TGI FRIDAYS","TGI FRIDAYS",NULL,NULL
"Spend $110 at Randalls","RANDALLS FOOD MARKETS",RANDALLS,NULL,NULL
"Reese's Chocolate Cones, 8 count at GIANT OR MARTINS","GIANT FOOD",KLONDIKE,"Frozen Desserts",Frozen
"Whole Pizza Pie at Casey's","CASEYS GENERAL STORE","CASEYS GENERAL STORE",NULL,NULL
"Shop 2 times at Star Market","STAR MARKET","STAR MARKET",NULL,NULL
"Hidden Valley Ranch Seasoning, select varieties",,"HIDDEN VALLEY RANCH","Dips & Salsa",Snacks
"General Mills products, select varieties, spend $12",,"ANNIES HOMEGROWN GROCERY",NULL,NULL
"Blue Apron Meal Kits","BLUE APRON","BLUE APRON",NULL,NULL
"Aleve products, select varieties, 80 count+ at Walmart",WALMART,ALEVE,NULL,NULL
"Welch's Juicefuls Juicy Fruit Snacks, 14 count, at Target",TARGET,"WELCHS FRUIT SNACKS","Fruit & Vegetable Snacks",Snacks
"Welch's Fruit Snacks, select varieties, 6 count+, buy 2",,"WELCHS FRUIT SNACKS","Fruit & Vegetable Snacks",Snacks
"Sign up for McAlister's Deli Rewards, tap for details","MCALISTERS DELI","MCALISTERS DELI",Milk,Dairy
"Sign up for McAlister's Deli Rewards, tap for details","MCALISTERS DELI","MCALISTERS DELI",Water,Beverages
"Sign up for McAlister's Deli Rewards, tap for details","MCALISTERS DELI","MCALISTERS DELI",Chips,Snacks
"Sign up for McAlister's Deli Rewards, tap for details","MCALISTERS DELI","MCALISTERS DELI",Cheese,Dairy
"Sign up for McAlister's Deli Rewards, tap for details","MCALISTERS DELI","MCALISTERS DELI","Carbonated Soft Drinks",Beverages
"Sign up for McAlister's Deli Rewards, tap for details","MCALISTERS DELI","MCALISTERS DELI",Cookies,Snacks
"Sign up for McAlister's Deli Rewards, tap for details","MCALISTERS DELI","MCALISTERS DELI","Fruit Juices",Beverages
"Sign up for McAlister's Deli Rewards, tap for details","MCALISTERS DELI","MCALISTERS DELI",Wine,Alcohol
"Sign up for McAlister's Deli Rewards, tap for details","MCALISTERS DELI","MCALISTERS DELI",Tea,Beverages
"Sign up for McAlister's Deli Rewards, tap for details","MCALISTERS DELI","MCALISTERS DELI","Leafy Salads","Deli & Bakery"
"Sign up for McAlister's Deli Rewards, tap for details","MCALISTERS DELI","MCALISTERS DELI","Prepared Meals","Deli & Bakery"
"Arbos Cheese Dip, 12 ounce, buy at Central Market","CENTRAL MARKET",ARBOS,NULL,NULL
"L'Oral Paris Excellence Hair Color at Target",TARGET,"LOREAL PARIS HAIR COLOR",NULL,NULL
"Kradle, select varieties, spend $20 at Walmart",WALMART,KRADLE,NULL,NULL
"Frozen OR Fountain Drink at Casey's","CASEYS GENERAL STORE","CASEYS GENERAL STORE",NULL,NULL
"Arnold, Brownberry, Oroweat Keto bread, buy 2",,"ARNOLD BROWNBERRY OROWEAT",Bread,Pantry
"Shop 2 times at Shaw's",SHAWS,SHAWS,NULL,NULL
"Welch'sFruit Snacks, spend $8",,"WELCHS FRUIT SNACKS","Fruit & Vegetable Snacks",Snacks
"Children's Astepro Allergy, 22 count at Dollar General","DOLLAR GENERAL STORE",ASTEPRO,NULL,NULL
"Spend $10 in-store at Casey's","CASEYS GENERAL STORE","CASEYS GENERAL STORE",NULL,NULL
"Fresh bakery item, select varieties, at Casey's","CASEYS GENERAL STORE","CASEYS GENERAL STORE",NULL,NULL
"SNICKERS chocolate candy bar, select varieties",,SNICKERS,Candy,Snacks
"Rao's Frozen Pizza",,RAO'S,NULL,NULL
"GATORADE Fast Twitch, 12-ounce single serve, buy 2 at Kroger","FRED MEYER",GATORADE,"Medicines & Treatments","Health & Wellness"
"GATORADE Fast Twitch, 12-ounce single serve, buy 2 at Kroger","FRED MEYER",GATORADE,"Sports Drinks","Sports Drinks & Enhanced Waters"
"Bimbo sweet baked goods, buy 2",,BIMBO,"Snack Cakes",Snacks
"Any Shaw's receipt",SHAWS,SHAWS,NULL,NULL
"Gorton's, at select retailers","STOP & SHOP",GORTONS,NULL,NULL
"Butterball, select varieties, spend $10 at Food 4 Less",FOOD4LESS,BUTTERBALL,NULL,NULL
"NatuChips Plantain Chips",,NATUCHIPS,NULL,NULL
"Beech-Nut pouches, buy 8",,BEECHNUT,NULL,NULL
"Spend $45 at Zaxby's",ZAXBYS,ZAXBYS,NULL,NULL
"Back to the Roots Raised Bed Gardening Kit with Soil, Seeds and Plant Food, at Target",TARGET,"BACK TO THE ROOTS",NULL,NULL
"Ben & Jerry's, select varieties, spend $12",,"BEN AND JERRYS","Frozen Desserts",Frozen
"Any ACME receipt",ACME,ACME,NULL,NULL
"Spend $220 at Tom Thumb","TOM THUMB","TOM THUMB",NULL,NULL
"Promised Land Dairy Milk, 52-ounce",,"PROMISED LAND DAIRY",NULL,NULL
"Welch's Fruit 'n Yogurt Snacks, 18 count, at Walmart",WALMART,"WELCHS FRUIT SNACKS","Fruit & Vegetable Snacks",Snacks
"Hidden Valley Ranch Seasoning Shaker",,"HIDDEN VALLEY RANCH","Dips & Salsa",Snacks
"CORE Hydration, select varieties, at Walmart",WALMART,"CORE HYDRATION",Water,Beverages
"When you join Costco as a Gold Star Member* (New Members Only)",COSTCO,COSTCO,NULL,NULL
"Whole pizza at Casey's","CASEYS GENERAL STORE","CASEYS GENERAL STORE",NULL,NULL
"Spend $40 at Farmer Boys","FARMER BOYS","FARMER BOYS",NULL,NULL
"Colgate Toothpaste AND Colgate Toothbrush, select varieties at Walmart or Target",TARGET,"COLGATE TOOTHBRUSHES",NULL,NULL
"L'Oral Paris Hair color, select varieties, spend $25 at Target",TARGET,"LOREAL PARIS HAIR COLOR",NULL,NULL
"TWIX, select varieties",,TWIX,Candy,Snacks
"Spend $15 at KFC",KFC,KFC,NULL,NULL
"Spend $275 at Vons",VONS,VONS,NULL,NULL
"EXTRA, select varieties",,EXTRA,Gum,Candy
"Ben & Jerry's Doggie Desserts, 4 ounce, buy 2",,"BEN AND JERRYS","Frozen Desserts",Frozen
"Klondike Cones, spend $10 at Walmart ",WALMART,KLONDIKE,"Frozen Desserts",Frozen
"Reese's Peanut Butter Bar, 6 count, at GIANT OR MARTINS","MARTINS FOODS","GOOD HUMOR",NULL,NULL
"Beyond Steak Plant-Based seared tips, 10 ounce at H-E-B",H-E-B,"BEYOND MEAT",NULL,NULL
"Kradle, select products, online at Chewy.com",CHEWY,KRADLE,NULL,NULL
"Spend $120 at Star Market","STAR MARKET","STAR MARKET",NULL,NULL
"Shop 2 times at Vons",VONS,VONS,NULL,NULL
"Wonderworks Keto* Friendly Cereal",,WONDERWORKS,NULL,NULL
"MTN DEW Kickstart, 16-ounce 12 count, select varieties, at Amazon Storefront*",AMAZON,"MOUNTAIN DEW","Carbonated Soft Drinks",Beverages
"When you join Costco as an Executive Member* (New Members Only)",COSTCO,COSTCO,NULL,NULL
"Adult Astepro Allergy, 22 count at Dollar General","DOLLAR GENERAL STORE",ASTEPRO,NULL,NULL
"Shop 2 times at Pavilions",PAVILIONS,PAVILIONS,NULL,NULL
"SKITTLES, select varieties",,SKITTLES,Candy,Snacks
"Stubborn Soda OR Bundaberg Ginger Beer, select varieties, at Amazon Storefront*",AMAZON,"STUBBORN SODA",NULL,NULL
"BallPark buns, buy 2",,"BALL PARK POP UPS",Bakery,"Deli & Bakery"
"BallPark buns, buy 2",,"BALL PARK POP UPS",Bread,Pantry
"12 Pack OR 2 Liter AND Whole Pizza at Casey's","CASEYS GENERAL STORE","CASEYS GENERAL STORE",NULL,NULL
"Spend $220 at Star Market","STAR MARKET","STAR MARKET",NULL,NULL
"Frozen OR Fountain Drink at Casey's ","CASEYS GENERAL STORE","CASEYS GENERAL STORE",NULL,NULL
"Spend $45 at TGI Friday's","TGI FRIDAYS","TGI FRIDAYS",NULL,NULL
"Visit OR order online from Casey's 3 times","CASEYS GENERAL STORE","CASEYS GENERAL STORE",NULL,NULL
"Spend $210 at Randalls","RANDALLS FOOD MARKETS",RANDALLS,NULL,NULL
"Visit OR order online from Casey's 5 times","CASEYS GENERAL STORE","CASEYS GENERAL STORE",NULL,NULL
"Any Tom Thumb receipt","TOM THUMB","TOM THUMB",NULL,NULL
"Butterball, select varieties, spend $10 at Fry's Food Store","FRYS FOOD STORE",BUTTERBALL,NULL,NULL
"ORBIT, select sizes, buy 1",,ORBIT,Gum,Candy
"12 pack OR 2 liter AND Whole Pizza at Casey's","CASEYS GENERAL STORE","CASEYS GENERAL STORE",NULL,NULL
"Molson Coors, select varieties, 12 Pack+, buy 2",,"TOPO CHICO HARD SELTZER","Hard Seltzers, Sodas, Waters, Lemonades & Teas",Alcohol
"Thomas', select varieties, spend $10",,THOMAS,Bread,Pantry
"Beyond Steak Plant-Based seared tips, 10 ounce, buy 2 at Target",TARGET,"BEYOND MEAT",NULL,NULL
"Whole Pizza at Casey's ","CASEYS GENERAL STORE","CASEYS GENERAL STORE",NULL,NULL
"EXTRA, select sizes",,EXTRA,Gum,Candy
"Gorton's at select retailers","STOP & SHOP",GORTONS,NULL,NULL
"Brita Standard OR Elite Filters",,BRITA,NULL,NULL
"Spend $300 at Shaws",SHAWS,SHAWS,NULL,NULL
"Spend $50 at Fresh Thyme Market","FRESH THYME MARKET","FRESH THYME MARKET",NULL,NULL
"Starry Lemon Lime Soda multipacks, at Kroger","DILLONS GROCERY",STARRY,NULL,NULL
"Barilla pasta, select varieties, buy 3",,BARILLA,Chips,Snacks
"Barilla pasta, select varieties, buy 3",,BARILLA,"Dry Pasta","Pasta & Noodles"
"Fresh Bakery Products at Casey's, select varieties","CASEYS GENERAL STORE","CASEYS GENERAL STORE",NULL,NULL
"Coors Light, Miller Lite OR VIZZY 12 packs+, buy 2",,VIZZY,NULL,NULL
"Kradle, select varieties, online at Amazon",AMAZON,KRADLE,NULL,NULL
"Starry Lemon Lime Soda, 7.5-ounce 10 pack, at Amazon Storefront*",AMAZON,STARRY,NULL,NULL
"EVOLVE Plant-Based Protein Shake, 4 count, select varieties, at Whole Foods","WHOLE FOODS MARKET",EVOLVE,NULL,NULL
"Burt's Bee's Facial Wipes, select varieties, 30 count at Walmart",WALMART,"BURTS BEES",NULL,NULL
"Aleve products AND AleveX, select varieties, at Walmart",WALMART,ALEVE,NULL,NULL
"Beyond Meat Plant-Based products, spend $15",,"BEYOND MEAT",NULL,NULL
"GOYA Adobo Seasoning, 8 ounce+",,GOYA,"Packaged Vegetables",Pantry
"GOYA Adobo Seasoning, 8 ounce+",,GOYA,"Cooking & Baking",Pantry
"Tyson Products, select varieties, spend $15 at Walmart",WALMART,AIDELLS,NULL,NULL
"Spend $210 at Safeway",SAFEWAY,SAFEWAY,NULL,NULL
"Klondike Cones at Walmart ",WALMART,KLONDIKE,"Frozen Desserts",Frozen
"Spend $110 at Albertsons",ALBERTSONS,ALBERTSONS,NULL,NULL
"Bubbies Pickles, Sauerkraut, OR Condiments at Whole Foods or Sprouts","SPROUTS FARMERS MARKET",BUBBIES,NULL,NULL
"Sara Lee or Alfaros Artesano bread, buy 2",,ALFAROS,NULL,NULL
"Beyond Meat Plant-Based products, spend $20",,"BEYOND MEAT",NULL,NULL
"Spend $10 on Casey's branded packaged products","CASEYS GENERAL STORE","CASEYS GENERAL STORE",NULL,NULL
"Any Randalls receipt","RANDALLS FOOD MARKETS",RANDALLS,NULL,NULL
"Arber, at Target",TARGET,ARBER,NULL,NULL
"Hagen-Dazs, 28 ounce, at GROCERY* stores",,"HAAGEN DAZS",NULL,NULL
"Spend $130 at ACME",ACME,ACME,NULL,NULL
"Spend $110 on a Full-Priced new Plus Membership and receive an ADDITIONAL 10,000 points","SAMS CLUB","SAMS CLUB",NULL,NULL
"Butterball, select varieties, spend $10 at QFC",QFC,BUTTERBALL,NULL,NULL
"Spend $100 at Pavilions",PAVILIONS,PAVILIONS,NULL,NULL
"Glad Trash Bags, 4 OR 8 Gallon",,GLAD,"Household Supplies","Household Supplies"
"Tostitos Toppers",,TOSTITOS,"Dips & Salsa",Snacks
"Tostitos Toppers",,TOSTITOS,Chips,Snacks
":ratio KETO* Friendly Cereal OR Granola",,RATIO,NULL,NULL
"Burt's Bees products, select varieties, at Walmart",WALMART,"BURTS BEES",NULL,NULL
"Bio-Oil products, select varieties",,"BIO OIL",NULL,NULL
"Andr California, Champagne OR Sparkling Wines, 750mL bottle",,ANDRE,NULL,NULL
"Spend $20 at Farmer Boys","FARMER BOYS","FARMER BOYS",NULL,NULL
"Any General Mills products, spend $50",,"ANNIES HOMEGROWN",NULL,NULL
"Chosen Foods Dressings",,"CHOSEN FOODS",NULL,NULL
"Spend $30 at Dickey's Barbecue Pit","DICKEYS BARBECUE PIT","DICKEYS BARBECUE PIT",NULL,NULL
"Degree for Men OR Women Dry Spray",,DEGREE,"Deodorant & Antiperspirant","Health & Wellness"
"Coors Light, Miller Lite OR VIZZY 12 packs+, buy 3",,VIZZY,NULL,NULL
"Back to the Roots Microgreens Grow Kit OR Seed Refill at Walmart",WALMART,"BACK TO THE ROOTS",NULL,NULL
"Spend $40 at KFC",KFC,KFC,NULL,NULL
"Bai Antioxidant, 6 pack, at Walmart",WALMART,BAI,"Fruit Juices",Beverages
"Spend $20 at Dickey's Barbecue Pit","DICKEYS BARBECUE PIT","DICKEYS BARBECUE PIT",NULL,NULL
"Spend $25 at TGI Friday's","TGI FRIDAYS","TGI FRIDAYS",NULL,NULL
"L'Oral Paris Hair color, select varieties, spend $9 at Target",TARGET,"LOREAL PARIS HAIR COLOR",NULL,NULL
"Sargento Sliced Cheese, spend $18",,SARGENTO,Cheese,Dairy
"SKITTLES, select sizes",,SKITTLES,Candy,Snacks
"LIFESAVERS, any size, buy 1",,LIFESAVERS,Candy,Snacks
"L'Oral Paris Makeup, spend $30 at Target",TARGET,"LOREAL PARIS COSMETICS",NULL,NULL
"Spend $115 at Tom Thumb","TOM THUMB","TOM THUMB",NULL,NULL
"Any Randalls receipt",RANDALLS,RANDALLS,NULL,NULL
"Spend $75 at Randalls",RANDALLS,RANDALLS,NULL,NULL
"Shop 2 times at Randalls","RANDALLS FOOD MARKETS",RANDALLS,NULL,NULL
"GATORADE Fast Twitch, 12-ounce single serve",,GATORADE,"Medicines & Treatments","Health & Wellness"
"GATORADE Fast Twitch, 12-ounce single serve",,GATORADE,"Sports Drinks","Sports Drinks & Enhanced Waters"
"Spend $10 at Nekter","NEKTER JUICE BAR",NEKTER,NULL,NULL
"Brownie Brittle Snacks, select varieties, buy 2",,"BROWNIE BRITTLE",NULL,NULL
"Cheerios Oat Crunch Berry Cereal",,CHEERIOS,"Cereal, Granola, & Toaster Pastries",Pantry
